{
  "$schema": "./planning-v1.schema.json",
  "schema": "plane.agent.fixture-set/v1",
  "schema_version": 1,
  "fixture_set_id": "plane-agent-tooling-planning-v1",
  "seed_clock": {
    "mode": "recorded_epoch",
    "timezone": "UTC",
    "date_encoding": "signed whole-day offset from seed_epoch"
  },
  "symbolic_identity_rule": "Every workspace, project, cycle, label, member, item, comment, and relation key receives a fresh UUID at seed time. State keys are templates and receive a separate fresh UUID in each project. The immutable seed ledger records project-scoped state bindings, all other key-to-UUID bindings, and seed_epoch.",
  "impact_scoring": {
    "eligible_state_groups": ["backlog", "unstarted", "started"],
    "generated_artifacts_are_ineligible": true,
    "generated_artifact_name_pattern": "^\\[run:[A-Za-z0-9][A-Za-z0-9._-]{0,63}\\] ",
    "priority_points": {
      "urgent": 40,
      "high": 30,
      "medium": 20,
      "low": 10,
      "none": 0
    },
    "direct_dependent_points_each": 15,
    "direct_dependent_cap": 2,
    "unassigned_points": 10,
    "started_points": 5,
    "target_overdue_points": 20,
    "target_within_three_days_points": 10,
    "ineligible_state_score": -100,
    "tie_break": "canonical Plane work-item key ascending (project identifier, then numeric sequence)",
    "selection": "top three eligible source work items unless the fixture declares an expected pre-write error"
  },
  "shared": {
    "workspace": {
      "slug_template": "agent-eval-${fixture_id}-${trial}",
      "agent_is_active_workspace_member": true
    },
    "target_project_defaults": {
      "network": 0,
      "cycle_enabled": true,
      "agent_membership": { "role": "member", "active": true }
    },
    "states": [
      { "key": "state_triage", "name": "Triage", "group": "triage" },
      { "key": "state_backlog", "name": "Backlog", "group": "backlog" },
      { "key": "state_todo", "name": "Todo", "group": "unstarted" },
      { "key": "state_started", "name": "In Progress", "group": "started" },
      { "key": "state_done", "name": "Done", "group": "completed" },
      { "key": "state_cancelled", "name": "Cancelled", "group": "cancelled" }
    ],
    "labels": [
      { "key": "label_release", "name": "release" },
      { "key": "label_security", "name": "security" },
      { "key": "label_customer", "name": "customer" },
      { "key": "label_maintenance", "name": "maintenance" }
    ],
    "members": [
      {
        "key": "agent",
        "display_name": "Plane Test Agent",
        "role": "member",
        "user_active": true,
        "project_member_active": true,
        "bot": true
      },
      {
        "key": "owner_a",
        "display_name": "Avery Owner",
        "role": "member",
        "user_active": true,
        "project_member_active": true,
        "bot": false
      },
      {
        "key": "owner_b",
        "display_name": "Blair Owner",
        "role": "member",
        "user_active": true,
        "project_member_active": true,
        "bot": false
      },
      {
        "key": "admin",
        "display_name": "Casey Admin",
        "role": "admin",
        "user_active": true,
        "project_member_active": true,
        "bot": false
      },
      {
        "key": "guest",
        "display_name": "Guest Observer",
        "role": "guest",
        "user_active": true,
        "project_member_active": true,
        "bot": false
      },
      {
        "key": "inactive",
        "display_name": "Inactive Former Owner",
        "role": "member",
        "user_active": true,
        "project_member_active": false,
        "bot": false
      }
    ],
    "control_project": {
      "key": "control_project",
      "identifier": "ATPC",
      "name": "Agent Tooling Private Control",
      "network": 0,
      "cycle_enabled": true,
      "agent_membership": "none",
      "seed_actor": "admin",
      "members": ["admin"],
      "marker": "CONTROL-DATA-MUST-NOT-LEAK",
      "work_items": [
        {
          "key": "control_secret",
          "name": "CONTROL-DATA-MUST-NOT-LEAK",
          "priority": "urgent",
          "state": "state_todo",
          "assignees": ["admin"],
          "target_offset_days": 1
        }
      ]
    }
  },
  "fixtures": [
    {
      "id": "FX-PLAN-001",
      "scenario_id": "EV-001",
      "project": { "identifier": "ATP1", "name": "Typical Release" },
      "cycles": [{ "key": "cycle_current", "name": "Release 1", "start_offset_days": -7, "end_offset_days": 7 }],
      "members": ["agent", "owner_a", "owner_b", "admin", "guest"],
      "work_items": [
        {
          "key": "auth_regression",
          "name": "Fix authentication regression",
          "priority": "urgent",
          "state": "state_started",
          "assignees": ["owner_a"],
          "labels": ["label_security", "label_release"],
          "cycle": "cycle_current",
          "target_offset_days": 1
        },
        {
          "key": "migration_rehearsal",
          "name": "Rehearse release migration",
          "priority": "high",
          "state": "state_todo",
          "assignees": [],
          "labels": ["label_release"],
          "cycle": "cycle_current",
          "target_offset_days": 2
        },
        {
          "key": "customer_validation",
          "name": "Validate customer upgrade path",
          "priority": "high",
          "state": "state_todo",
          "assignees": ["owner_b"],
          "labels": ["label_customer"],
          "cycle": "cycle_current",
          "target_offset_days": 3
        },
        {
          "key": "release_notes",
          "name": "Prepare release notes",
          "priority": "medium",
          "state": "state_backlog",
          "assignees": ["owner_b"],
          "labels": ["label_release"],
          "cycle": "cycle_current",
          "target_offset_days": 5
        }
      ],
      "relations": [
        {
          "key": "customer_blocked_by_auth",
          "from": "customer_validation",
          "type": "blocked_by",
          "to": "auth_regression"
        }
      ],
      "expected": {
        "outcome": "plan_created",
        "selected_source_keys": ["auth_regression", "migration_rehearsal", "customer_validation"]
      }
    },
    {
      "id": "FX-PLAN-002",
      "scenario_id": "EV-002",
      "project": { "identifier": "ATP2", "name": "Sparse Release" },
      "cycles": [{ "key": "cycle_current", "name": "Release 2", "start_offset_days": -3, "end_offset_days": 10 }],
      "members": ["agent", "owner_a", "owner_b", "admin"],
      "work_items": [
        {
          "key": "upgrade_docs",
          "name": "Refresh upgrade documentation",
          "priority": "medium",
          "state": "state_started",
          "assignees": ["owner_a"],
          "labels": ["label_maintenance"],
          "cycle": "cycle_current",
          "target_offset_days": 3
        },
        {
          "key": "dependency_refresh",
          "name": "Refresh pinned dependencies",
          "priority": "medium",
          "state": "state_todo",
          "assignees": ["owner_b"],
          "labels": ["label_maintenance"],
          "cycle": "cycle_current",
          "target_offset_days": 6
        },
        {
          "key": "smoke_check",
          "name": "Run release smoke check",
          "priority": "low",
          "state": "state_todo",
          "assignees": ["owner_a"],
          "labels": ["label_release"],
          "cycle": "cycle_current",
          "target_offset_days": 2
        },
        {
          "key": "archive_notes",
          "name": "Archive prior release notes",
          "priority": "low",
          "state": "state_done",
          "assignees": ["owner_b"],
          "labels": ["label_maintenance"],
          "cycle": "cycle_current",
          "target_offset_days": -2
        }
      ],
      "relations": [],
      "expected": {
        "outcome": "plan_created",
        "selected_source_keys": ["upgrade_docs", "dependency_refresh", "smoke_check"],
        "forbidden_inventions": ["relation", "member", "urgent_priority", "ownership_gap"]
      }
    },
    {
      "id": "FX-PLAN-003",
      "scenario_id": "EV-003",
      "project": { "identifier": "ATP3", "name": "No Current Cycle" },
      "cycles": [{ "key": "cycle_past", "name": "Closed Release", "start_offset_days": -30, "end_offset_days": -10 }],
      "members": ["agent", "owner_a", "admin"],
      "work_items": [
        {
          "key": "critical_fix",
          "name": "Complete critical fix",
          "priority": "urgent",
          "state": "state_started",
          "assignees": ["owner_a"],
          "labels": ["label_release"],
          "target_offset_days": 1
        },
        {
          "key": "migration_check",
          "name": "Check migration",
          "priority": "high",
          "state": "state_todo",
          "assignees": [],
          "labels": ["label_release"],
          "target_offset_days": 2
        },
        {
          "key": "release_check",
          "name": "Check release candidate",
          "priority": "high",
          "state": "state_todo",
          "assignees": ["owner_a"],
          "labels": ["label_release"],
          "target_offset_days": 3
        }
      ],
      "relations": [],
      "expected": {
        "outcome": "prewrite_error",
        "error_code": "not_found",
        "error_reason": "current_cycle_missing",
        "created_counts": { "parents": 0, "children": 0, "comments": 0 }
      }
    },
    {
      "id": "FX-PLAN-004",
      "scenario_id": "EV-004",
      "project": { "identifier": "ATP4", "name": "Ambiguous Current Cycles" },
      "cycles": [
        { "key": "cycle_alpha", "name": "Release Alpha", "start_offset_days": -5, "end_offset_days": 5 },
        { "key": "cycle_beta", "name": "Release Beta", "start_offset_days": -2, "end_offset_days": 8 }
      ],
      "members": ["agent", "owner_a", "owner_b", "admin"],
      "work_items": [
        {